id,created_at,source,original_text,clean_text,sentiment,polarity,subjectivity,lang,favorite_count,retweet_count,original_author,possibly_sensitive,hashtags,user_mentions,place,place_coord_boundaries1240737476198535168,Thu Mar 19 20:30:40 +0000 2020,"<a href=""https://mobile.twitter.com"" rel=""nofollow"">Twitter Web App</a>","RT @literatureposts: Their #bonding #ceremony opened the gateway to another dimension, but being in a #new world won't stop her men from #l…",Their opened gateway another dimension world wo n't stop men …,"Sentiment(polarity=0.0, subjectivity=0.0)",0.0,0.0,en,0,495,NeilPort2,,"bonding, ceremony, new",literatureposts,"Newcastle, New South Wales",
1240737000426217472,Thu Mar 19 20:28:47 +0000 2020,"<a href=""http://twitter.com/download/iphone"" rel=""nofollow"">Twitter for iPhone</a>",@nickynoo007 I’m planning on cleaning the oven tomorrow! #exciting #lockdownespania,I ’ planning cleaning oven tomorrow,"Sentiment(polarity=0.0, subjectivity=0.0)",0.0,0.0,en,2,0,Jargent,,"exciting, lockdownespania",nickynoo007,London Orhuela Spain,
1240735621930520576,Thu Mar 19 20:23:18 +0000 2020,"<a href=""https://socialrabbitplugin.com"" rel=""nofollow"">SocialRabbit Plugin</a>",Mountains and the Wolf Landscape Wall Posters #stylishwallart #beautiful #decor #excited #play… https://t.co/NTslOvnPmM,Mountains Wolf Landscape Wall Posters …,"Sentiment(polarity=0.0, subjectivity=0.0)",0.0,0.0,en,0,0,stylishwallart,False,"stylishwallart, beautiful, decor, excited, play",,United States,
1240734978113187843,Thu Mar 19 20:20:45 +0000 2020,"<a href=""http://twitter.com/download/iphone"" rel=""nofollow"">Twitter for iPhone</a>",both my aunt and sister in law are expecting #excited 🤩🤩🤩,aunt sister law eecting 🤩🤩🤩,"Sentiment(polarity=0.0, subjectivity=0.0)",0.0,0.0,en,0,0,yagirlbriana,,excited,,"Houston, TX",
1240733773852897280,Thu Mar 19 20:15:58 +0000 2020,"<a href=""https://mobile.twitter.com"" rel=""nofollow"">Twitter Web App</a>",RT @Polishrob24: Don’t miss it !! #Swordandshield #pokemon #tradingcardgame #pokemontcg #poketuber #hyperrare #pokemongame #pokemongo #inst…,Don ’ miss …,"Sentiment(polarity=0.0, subjectivity=0.0)",0.0,0.0,en,0,1,SudonLives,,"Swordandshield, pokemon, tradingcardgame, pokemontcg, poketuber, hyperrare, pokemongame, pokemongo",Polishrob24,"Aurora, Colorado",
1240733473733857280,Thu Mar 19 20:14:46 +0000 2020,"<a href=""http://twitter.com/download/iphone"" rel=""nofollow"">Twitter for iPhone</a>",My photo's just been accepted by @Stockimo &amp; it's now for sale on @Alamy #photography #excited #Sunset https://t.co/y7zWuX8Nko,My photo 's accepted amp 's sale,"Sentiment(polarity=0.0, subjectivity=0.0)",0.0,0.0,en,3,1,moukahal,False,"photography, excited, Sunset","stockimo, alamy","Beirut, Lebanon",
1240731494076817415,Thu Mar 19 20:06:54 +0000 2020,"<a href=""http://twitter.com/download/iphone"" rel=""nofollow"">Twitter for iPhone</a>",gonna listen to my time for the first time #excited,gon na listen time first time,"Sentiment(polarity=0.25, subjectivity=0.3333333333333333)",0.25,0.3333333333333333,en,2,0,vantehj,,excited,,any pronouns!!,
1240730994455560194,Thu Mar 19 20:04:55 +0000 2020,"<a href=""http://twitter.com/download/iphone"" rel=""nofollow"">Twitter for iPhone</a>",@TotallyRunable @JennyMeadows800 @NatJackson52 @emkfree After #coronavirus can I come and meet!! #excited,After I come meet,"Sentiment(polarity=0.0, subjectivity=0.0)",0.0,0.0,en,5,0,rams1101,,"coronavirus, excited","TotallyRunable, JennyMeadows800, NatJackson52, emkfree",,"[[-1.0356488, 53.5603232], [-0.9883712, 53.5603232], [-0.9883712, 53.5871248], [-1.0356488, 53.5871248]]"
1240729820465631240,Thu Mar 19 20:00:15 +0000 2020,"<a href=""https://appitek.com"" rel=""nofollow"">AppitekBot</a>",RT @EmmaLBowley: So that’s my app all setup ready for @ldnscalling tomorrow! #exciting #salesforce #trailblazers,So ’ app setup ready tomorrow,"Sentiment(polarity=0.2, subjectivity=0.5)",0.2,0.5,en,0,1,appitekbot,,"exciting, salesforce, trailblazers","EmmaLBowley, LdnsCalling",The Cloud,
1240729798240018434,Thu Mar 19 20:00:10 +0000 2020,"<a href=""http://attendify.com"" rel=""nofollow"">Attendify Event App</a>",So that’s my app all setup ready for @ldnscalling tomorrow! #exciting #salesforce #trailblazers,So ’ app setup ready tomorrow,"Sentiment(polarity=0.2, subjectivity=0.5)",0.2,0.5,en,2,1,EmmaLBowley,,"exciting, salesforce, trailblazers",LdnsCalling,"Derby, United Kingdom",
1240728200654643200,Thu Mar 19 19:53:49 +0000 2020,"<a href=""http://twitter.com/download/android"" rel=""nofollow"">Twitter for Android</a>","RT @14TSF: In Non #CoronaVirus News, We can't wait to share our #exciting and #BIGNEWS! Stay tuned to see what @TonyStewart and the Foundat…",In Non News We ca n't wait share Stay tuned see Foundat…,"Sentiment(polarity=0.0, subjectivity=0.0)",0.0,0.0,en,0,8,Maryann7309356,,"CoronaVirus, exciting, BIGNEWS","14TSF, TonyStewart",Yakima Washington,
1240728171357638657,Thu Mar 19 19:53:42 +0000 2020,"<a href=""http://twitter.com/download/iphone"" rel=""nofollow"">Twitter for iPhone</a>",RT @HolidayHampers: Moved into our new premises today 🥰 Loads of exciting things to come. #SmallBusiness #SmallBiz #excited https://t.co/pJ…,Moved new premises today 🥰 Loads exciting things come,"Sentiment(polarity=0.21818181818181817, subjectivity=0.6272727272727273)",0.21818181818181817,0.6272727272727273,en,0,3,smallbizshoutUK,,"SmallBusiness, SmallBiz, excited",HolidayHampers,United Kingdom,
1240727918428303360,Thu Mar 19 19:52:42 +0000 2020,"<a href=""https://mobile.twitter.com"" rel=""nofollow"">Twitter Web App</a>","RT @14TSF: In Non #CoronaVirus News, We can't wait to share our #exciting and #BIGNEWS! Stay tuned to see what @TonyStewart and the Foundat…",In Non News We ca n't wait share Stay tuned see Foundat…,"Sentiment(polarity=0.0, subjectivity=0.0)",0.0,0.0,en,0,8,SageFruit,,"CoronaVirus, exciting, BIGNEWS","14TSF, TonyStewart",Washington,
1240726535012843521,Thu Mar 19 19:47:12 +0000 2020,"<a href=""http://instagram.com"" rel=""nofollow"">Instagram</a>",#Tomorrow I am on @bbc6music with laurenlaverne 9.10 with my #desertislanddisco Who was there in the #1990s #excited https://t.co/yLzDWm84Nu,I laurenlaverne 0 Who,"Sentiment(polarity=0.0, subjectivity=0.0)",0.0,0.0,en,7,0,adamskitweet,False,"Tomorrow, desertislanddisco, 1990s, excited",BBC6Music,London Town,
1240726351813808128,Thu Mar 19 19:46:28 +0000 2020,"<a href=""http://twitter.com/download/iphone"" rel=""nofollow"">Twitter for iPhone</a>",#Excited for Day 4 of #CareerWeek @devryuniv and this afternoons “Branding &amp; Recruiting: Highlighting the Best Vers… https://t.co/7xpkxO1xAw,Day afternoons “ Branding amp Recruiting Highlighting Best Vers…,"Sentiment(polarity=1.0, subjectivity=0.3)",1.0,0.3,en,1,0,SaraAnnRose,,"Excited, CareerWeek",devryuniv,The Clouds,
1240725467302371330,Thu Mar 19 19:42:57 +0000 2020,"<a href=""http://twitter.com/download/android"" rel=""nofollow"">Twitter for Android</a>","Super SUPER #excited! 😁

I'm always looking for ways to work on my #personaldevelopment. Mainly because I enjoy it… https://t.co/IeKg68OG4g",Super SUPER I 'm always looking ways work Mainly I enjoy it…,"Sentiment(polarity=0.35555555555555557, subjectivity=0.611111111111111)",0.35555555555555557,0.611111111111111,en,7,0,Recre8_8,False,"excited, personaldevelopment",,Middlesbrough,
1240723078897754112,Thu Mar 19 19:33:28 +0000 2020,"<a href=""http://instagram.com"" rel=""nofollow"">Instagram</a>",Don’t miss it !! #Swordandshield #pokemon #tradingcardgame #pokemontcg #poketuber #hyperrare #pokemongame… https://t.co/k1ocxNrhUn,Don ’ miss …,"Sentiment(polarity=0.0, subjectivity=0.0)",0.0,0.0,en,3,1,Polishrob24,False,"Swordandshield, pokemon, tradingcardgame, pokemontcg, poketuber, hyperrare, pokemongame",,Orando,
1240722898647728128,Thu Mar 19 19:32:45 +0000 2020,"<a href=""http://twitter.com/download/android"" rel=""nofollow"">Twitter for Android</a>","RT @HumanitasSsi: We can’t wait, we can’t wait!! One day to go for H-SSI Contest! Be ready to participate 🥳

#ContestAlert #Contestmania #C…",We ’ wait ’ wait One day go H-SSI Contest Be ready participate 🥳 …,"Sentiment(polarity=0.2, subjectivity=0.5)",0.2,0.5,en,0,2,Pranab1151,,"ContestAlert, Contestmania",HumanitasSsi,"Barasat, Kolkata",
1240721451830763520,Thu Mar 19 19:27:00 +0000 2020,"<a href=""https://mobile.twitter.com"" rel=""nofollow"">Twitter Web App</a>",I am VERY #EXCITED to announce I will be receiving @Bethesda_UK's #DoomEternal with the @GameUKOnline… https://t.co/3hafSsI6uM,I VERY announce I receiving 's …,"Sentiment(polarity=0.2, subjectivity=0.3)",0.2,0.3,en,1,0,LamerGam3r,False,"EXCITED, DoomEternal","Bethesda_UK, GameUKOnline",Bristol,
1240721438027534340,Thu Mar 19 19:26:56 +0000 2020,"<a href=""http://twitter.com/download/iphone"" rel=""nofollow"">Twitter for iPhone</a>",Watch out for a virtual Wigan School Games coming soon!! @EastWigan #reframecompetition #TEAMWigan #exciting #fun… https://t.co/WPXjmo2pTd,Watch virtual Wigan School Games coming soon …,"Sentiment(polarity=0.0, subjectivity=0.0)",0.0,0.0,en,21,0,cathi2122,,"reframecompetition, TEAMWigan, exciting, fun",EastWigan,"Wigan, England",
1240721148091957251,Thu Mar 19 19:25:47 +0000 2020,"<a href=""https://mobile.twitter.com"" rel=""nofollow"">Twitter Web App</a>",Thank you so much for our new marketing materials #exciting https://t.co/XPmF5V1Z89,Thank much new marketing materials,"Sentiment(polarity=0.13636363636363635, subjectivity=0.45454545454545453)",0.13636363636363635,0.45454545454545453,en,0,0,MoonHallReigate,False,exciting,,"Reigate, Surrey RH2 8RE",
1240720246044069888,Thu Mar 19 19:22:12 +0000 2020,"<a href=""http://www.wildlingtravels.in/"" rel=""nofollow"">WIldling Travels</a>","RT @LesleyStyle: Our adventure has begun, we’ve made it to Athens and now onto Kythira tomorrow! 

.
.
.
.
.
.
#adventure #athens #away #tr…",Our adventure begun ’ made Athens onto Kythira tomorrow …,"Sentiment(polarity=0.0, subjectivity=0.0)",0.0,0.0,en,0,1,WildlingTravels,,"adventure, athens, away",LesleyStyle,"New Delhi, India",
1240719417744359424,Thu Mar 19 19:18:55 +0000 2020,"<a href=""http://twitter.com/download/android"" rel=""nofollow"">Twitter for Android</a>","Hands up who loved this...

Cos tomorrow I've got a new colour winging it's way to you...

#new #colour #excited https://t.co/tHwVgzM9N7",Hands loved ... Cos tomorrow I 've got new colour winging 's way ...,"Sentiment(polarity=0.41818181818181815, subjectivity=0.6272727272727273)",0.41818181818181815,0.6272727272727273,en,6,2,vsknickemporium,False,"new, colour, excited",,UK,
1240719314023481345,Thu Mar 19 19:18:30 +0000 2020,"<a href=""http://twitter.com/download/iphone"" rel=""nofollow"">Twitter for iPhone</a>","So after the vote for a Logo from close Family and Friends, The Majority Vote is In.
THANK YOU TO MY VILLAGE FOR YO… https://t.co/A21wucaISt",So vote Logo close Family Friends The Majority Vote In THANK YOU TO MY VILLAGE FOR YO…,"Sentiment(polarity=0.0, subjectivity=0.0)",0.0,0.0,en,0,0,DriverKatina,False,,,,
1240719172516151297,Thu Mar 19 19:17:56 +0000 2020,"<a href=""http://twitter.com/download/iphone"" rel=""nofollow"">Twitter for iPhone</a>",Here’s my  #positivenews the new Animal crossing game is out tomorrow! Pre-ordered and being delivered tomorrow fir… https://t.co/XJMWTzNz7d,Here ’ new Animal crossing game tomorrow Pre-ordered delivered tomorrow fir…,"Sentiment(polarity=-0.13181818181818183, subjectivity=0.42727272727272725)",-0.13181818181818183,0.42727272727272725,en,0,0,devils_out,,positivenews,,,
1240719061773844480,Thu Mar 19 19:17:30 +0000 2020,"<a href=""https://mobile.twitter.com"" rel=""nofollow"">Twitter Web App</a>",@ScanComputers @Seagate @AMD_UK @ASUS_ROG @seagategaming Dream come true if I won this. #excited #fingerscrossed #inittowinit #,Dream come true I,"Sentiment(polarity=0.35, subjectivity=0.65)",0.35,0.65,en,0,0,CrampAlex,,"excited, fingerscrossed, inittowinit","ScanComputers, Seagate, AMD_UK, ASUS_ROG, seagategaming",,
1240718937773334528,Thu Mar 19 19:17:00 +0000 2020,"<a href=""http://twitter.com/download/iphone"" rel=""nofollow"">Twitter for iPhone</a>",RT @CrossPoteet: So proud of the Lady Poteet Pirates for coming to practice over Spring Break!!! We even had some future Pirates putting in…,So proud Lady Poteet Pirates coming practice Spring Break We even future Pirates putting in…,"Sentiment(polarity=0.4, subjectivity=0.5625)",0.4,0.5625,en,0,1,theeyenvymari,,,CrossPoteet,On The Track🤫,
1240718645795454981,Thu Mar 19 19:15:51 +0000 2020,"<a href=""http://instagram.com"" rel=""nofollow"">Instagram</a>","Our adventure has begun, we’ve made it to Athens and now onto Kythira tomorrow! 

.
.
.
.
.
.
#adventure #athens… https://t.co/Cvgmway78b",Our adventure begun ’ made Athens onto Kythira tomorrow …,"Sentiment(polarity=0.0, subjectivity=0.0)",0.0,0.0,en,1,1,LesleyStyle,False,"adventure, athens",,Northamptonshire UK,
1240717439538733056,Thu Mar 19 19:11:03 +0000 2020,"<a href=""https://ifttt.com"" rel=""nofollow"">IFTTT</a>",🌲We have a happy little announcement🌲  We're officially licensed to create Bob Ross merch! 🎨 We're so excited! Keep… https://t.co/vbWumH5Oyg,We happy little announcement We 're officially licensed create Bob Ross merch We 're excited Keep…,"Sentiment(polarity=0.32916666666666666, subjectivity=0.75)",0.32916666666666666,0.75,en,1,0,calhounstore,False,,,"St. Catharines, Ontario",
1240716987896156167,Thu Mar 19 19:09:15 +0000 2020,"<a href=""http://twitter.com/download/android"" rel=""nofollow"">Twitter for Android</a>","Literally counting down the hours 'til animal crossing!
You can find this free pattern here:… https://t.co/7I7tAeRuW8",Literally counting hours 'til animal crossing You find free pattern …,"Sentiment(polarity=0.4, subjectivity=0.8)",0.4,0.8,en,3,0,megscrochetmrkt,False,,,,
1240716915011616773,Thu Mar 19 19:08:58 +0000 2020,"<a href=""http://twitter.com/download/iphone"" rel=""nofollow"">Twitter for iPhone</a>",@ConyersSchool Good luck and let’s all make this exciting. It may be a difficult time but WOW how we can all learn… https://t.co/DMtTIrJhcv,Good luck let ’ make exciting It may difficult time WOW learn…,"Sentiment(polarity=0.15, subjectivity=0.8500000000000001)",0.15,0.8500000000000001,en,0,0,SquidgersMum,,,ConyersSchool,United Kingdom,
1240716500648034304,Thu Mar 19 19:07:19 +0000 2020,"<a href=""http://twitter.com/download/android"" rel=""nofollow"">Twitter for Android</a>",The @BBCiPlayer is so loaded with stuff I really don't know how I'm going to find the time to fit it all in. I'm pa… https://t.co/nW83onQqk1,The loaded stuff I really n't know I 'm going find time fit I 'm pa…,"Sentiment(polarity=0.30000000000000004, subjectivity=0.30000000000000004)",0.30000000000000004,0.30000000000000004,en,2,0,ADLJ,,,BBCiPlayer,Hampshire,
1240715683970703360,Thu Mar 19 19:04:05 +0000 2020,"<a href=""http://twitter.com/download/iphone"" rel=""nofollow"">Twitter for iPhone</a>","@anandmahindra ji, when is the new #Bolero likely to be on road? April or August 2020? #excited",ji new likely road April August,"Sentiment(polarity=0.06818181818181818, subjectivity=0.7272727272727273)",0.06818181818181818,0.7272727272727273,en,1,0,manashTOI,,"Bolero, excited",anandmahindra,"New Delhi, India",
1240714624800034818,Thu Mar 19 18:59:52 +0000 2020,"<a href=""http://instagram.com"" rel=""nofollow"">Instagram</a>",So Excited To Hear @kelseaballerini New Album Tonight. #kelsea #newmusiccomingsoon #loveher #excited #cantwait… https://t.co/HQQ7OGSn6n,So Excited To Hear New Album Tonight …,"Sentiment(polarity=0.2556818181818182, subjectivity=0.6022727272727273)",0.2556818181818182,0.6022727272727273,en,0,0,HSandSSfanever,False,"kelsea, newmusiccomingsoon, loveher, excited, cantwait",KelseaBallerini,,
1240714530008764416,Thu Mar 19 18:59:29 +0000 2020,"<a href=""http://twitter.com/download/iphone"" rel=""nofollow"">Twitter for iPhone</a>",I look so happy here and my stomach was out... #excited,I look happy stomach ...,"Sentiment(polarity=0.8, subjectivity=1.0)",0.8,1.0,en,0,0,funkytownnnn,,excited,,in yanii’s bed ,
1240713910451343360,Thu Mar 19 18:57:02 +0000 2020,"<a href=""http://twitter.com/download/android"" rel=""nofollow"">Twitter for Android</a>","RT @RayeDavies: So, this afternoon I ordered @MatthewH_books ‘The Black Art of Killing’, Clare Pooley’s ‘The Authenticity Project’ &amp; 2 copi…",So afternoon I ordered ‘ The Black Art Killing ’ Clare Pooley ’ ‘ The Authenticity Project ’ amp copi…,"Sentiment(polarity=-0.16666666666666666, subjectivity=0.43333333333333335)",-0.16666666666666666,0.43333333333333335,en,0,1,MatthewH_books,,,"RayeDavies, MatthewH_books","Welsh Newton Common, UK",
1240712112269336577,Thu Mar 19 18:49:53 +0000 2020,"<a href=""http://twitter.com/download/android"" rel=""nofollow"">Twitter for Android</a>",RT @GamingPriskon: Guys new song of #SidNaaz is coming so how much #Excited you are? Tell me by doing comment on my tweet and plz follow me…,Guys new song coming much Tell comment tweet plz follow me…,"Sentiment(polarity=0.16818181818181818, subjectivity=0.32727272727272727)",0.16818181818181818,0.32727272727272727,en,0,3,BistiShabnam,,"SidNaaz, Excited",GamingPriskon,,
1240711571669565441,Thu Mar 19 18:47:44 +0000 2020,"<a href=""http://twitter.com/download/android"" rel=""nofollow"">Twitter for Android</a>",RT @GamingPriskon: Guys new song of #SidNaaz is coming so how much #Excited you are? Tell me by doing comment on my tweet and plz follow me…,Guys new song coming much Tell comment tweet plz follow me…,"Sentiment(polarity=0.16818181818181818, subjectivity=0.32727272727272727)",0.16818181818181818,0.32727272727272727,en,0,3,Shamanth000,,"SidNaaz, Excited",GamingPriskon,Bengaluru,
1240711458209460227,Thu Mar 19 18:47:17 +0000 2020,"<a href=""http://twitter.com/download/android"" rel=""nofollow"">Twitter for Android</a>",Guys new song of #SidNaaz is coming so how much #Excited you are? Tell me by doing comment on my tweet and plz foll… https://t.co/ozmoEZClvS,Guys new song coming much Tell comment tweet plz foll…,"Sentiment(polarity=0.16818181818181818, subjectivity=0.32727272727272727)",0.16818181818181818,0.32727272727272727,en,3,3,GamingPriskon,,"SidNaaz, Excited",,,
1240709542037471232,Thu Mar 19 18:39:40 +0000 2020,"<a href=""http://twitter.com/download/iphone"" rel=""nofollow"">Twitter for iPhone</a>",@lizzienugent Woohoo!! Going straight on my @GutterDalkey drive-by collection list! I’m hoping Marta’s gonna frisbe… https://t.co/vWtpznje4G,Woohoo Going straight drive-by collection list I ’ hoping Marta ’ gon na frisbe…,"Sentiment(polarity=0.2, subjectivity=0.4)",0.2,0.4,en,2,0,shewithonee,,,"lizzienugent, GutterDalkey",Dublin (the one in Ireland...),
1240708704938283009,Thu Mar 19 18:36:21 +0000 2020,"<a href=""http://twitter.com/download/android"" rel=""nofollow"">Twitter for Android</a>","@JohnRMoffitt I pray no one gets too #excited and falls the fuck off?

That ain't genius.",I pray one gets falls fuck That ai n't genius,"Sentiment(polarity=-0.4, subjectivity=0.6)",-0.4,0.6,en,1,0,olakunle1900,,excited,JohnRMoffitt,International.,
1240708168730148866,Thu Mar 19 18:34:13 +0000 2020,"<a href=""http://twitter.com/download/android"" rel=""nofollow"">Twitter for Android</a>",RT @KirstyOughton26: Well isn’t this some amazing #bookpost from @AvonBooksUK Thank you so much. Ive read #NeverSawYouComing by @HayleyDWri…,Well ’ amazing Thank much Ive read …,"Sentiment(polarity=0.4, subjectivity=0.55)",0.4,0.55,en,0,4,sammilad,,"bookpost, NeverSawYouComing","KirstyOughton26, AvonBooksUK","Runcorn, England",
1240706403322347520,Thu Mar 19 18:27:12 +0000 2020,"<a href=""http://instagram.com"" rel=""nofollow"">Instagram</a>",Can’t thank @ThtWrestleClub for this. originalfunko undertaker #darkparlororiginals #darkparlor #wwe #theundertaker… https://t.co/9yniJr2GeL,Can ’ thank originalfunko undertaker …,"Sentiment(polarity=0.0, subjectivity=0.0)",0.0,0.0,en,0,0,TheJackBarbosa,False,"darkparlororiginals, darkparlor, wwe, theundertaker",,"Manahawkin, NJ",
1240705508543250437,Thu Mar 19 18:23:39 +0000 2020,"<a href=""http://twitter.com/download/android"" rel=""nofollow"">Twitter for Android</a>","When you find out you have a fox living under your shed 🤗🤗🥰🥰
#privileged #animals #wildlifeconservation #excited https://t.co/1XB8tCPyO0",When find fox living shed 🤗🤗🥰🥰,"Sentiment(polarity=0.0, subjectivity=0.0)",0.0,0.0,en,0,0,blondenerd81,False,"privileged, animals, wildlifeconservation, excited",,"England, United Kingdom",
1240705419258908672,Thu Mar 19 18:23:17 +0000 2020,"<a href=""http://twitter.com/download/android"" rel=""nofollow"">Twitter for Android</a>","RT @Julia_Eaton_UK: 🚨@ClayneCrawford MOVIE NEWS‼️

🎬#TheKillingOfTwoLovers worldwide sales rights have been acquired by The Exchange, who a…",MOVIE NEWS‼️ worldwide sales rights acquired The Exchange a…,"Sentiment(polarity=0.0, subjectivity=0.0)",0.0,0.0,en,0,9,lincoln_lezli,,TheKillingOfTwoLovers,"Julia_Eaton_UK, ClayneCrawford",,
1240703496908754945,Thu Mar 19 18:15:39 +0000 2020,"<a href=""http://twitter.com/download/iphone"" rel=""nofollow"">Twitter for iPhone</a>",C’mon y’all. Do this with me. #vent about your #joys !!!  What #goodthings have happened for you in the last two we… https://t.co/j8drI7Ltsx,C ’ mon ’ Do What happened last two we…,"Sentiment(polarity=0.0, subjectivity=0.06666666666666667)",0.0,0.06666666666666667,en,3,0,TangieAmbrose,False,"vent, joys, goodthings",,California...,
1240702112943624193,Thu Mar 19 18:10:09 +0000 2020,"<a href=""http://twitter.com/download/android"" rel=""nofollow"">Twitter for Android</a>","RT @Julia_Eaton_UK: 🚨@ClayneCrawford MOVIE NEWS‼️

🎬#TheKillingOfTwoLovers worldwide sales rights have been acquired by The Exchange, who a…",MOVIE NEWS‼️ worldwide sales rights acquired The Exchange a…,"Sentiment(polarity=0.0, subjectivity=0.0)",0.0,0.0,en,0,9,Kris_Kaniac,,TheKillingOfTwoLovers,"Julia_Eaton_UK, ClayneCrawford",Michigan,
1240700988970827776,Thu Mar 19 18:05:41 +0000 2020,"<a href=""http://instagram.com"" rel=""nofollow"">Instagram</a>",Some happy news to share with you all ❤️ We are excited to announce that Georgia has been selected to be part of th… https://t.co/Ro1IPcjU7d,Some happy news share ️ We excited announce Georgia selected part th…,"Sentiment(polarity=0.5875, subjectivity=0.875)",0.5875,0.875,en,1,0,OlympusGymClub,False,,,"Llay, Wrexham, LL12 0PJ",
1240700805654573057,Thu Mar 19 18:04:57 +0000 2020,"<a href=""http://twitter.com/download/iphone"" rel=""nofollow"">Twitter for iPhone</a>",I’m about to make MORE coffee.. #excited #coffeetime #coffeelover,I ’ make MORE coffee..,"Sentiment(polarity=0.5, subjectivity=0.5)",0.5,0.5,en,0,0,KaboomSofiee,,"excited, coffeetime, coffeelover",,"Texas, USA",
1240700311741665280,Thu Mar 19 18:03:00 +0000 2020,"<a href=""http://twitter.com/download/android"" rel=""nofollow"">Twitter for Android</a>","RT @NASASpaceflight: ""NASA, SpaceX Invite Media to First Crew Launch to Station from America Since 2011.

This line:

""The first launch of…",`` NASA SpaceX Invite Media First Crew Launch Station America Since This line `` The first launch of…,"Sentiment(polarity=0.25, subjectivity=0.3333333333333333)",0.25,0.3333333333333333,en,0,103,ZajacRafal,,,NASASpaceflight,"Wrocław, Polska",
1240699892701351937,Thu Mar 19 18:01:20 +0000 2020,"<a href=""https://www.later.com"" rel=""nofollow"">LaterMedia</a>","HAPPY SPRING! Yay for warmer temperatures, trees and flowers blooming, and seeing new life.

⁠""Spring shows what Go… https://t.co/GCcGPYEDwj",HAPPY SPRING Yay warmer temperatures trees flowers blooming seeing new life ⁠ '' Spring shows Go…,"Sentiment(polarity=0.4681818181818182, subjectivity=0.7272727272727273)",0.4681818181818182,0.7272727272727273,en,0,0,Instaburstphoto,False,,,"Franklin, TN",
1240699644868358144,Thu Mar 19 18:00:21 +0000 2020,"<a href=""https://mobile.twitter.com"" rel=""nofollow"">Twitter Web App</a>",Brilliant resource when I was studying. Now thrilled at the thought of delving in again....#novel #research… https://t.co/KVwbRLiUjL,Brilliant resource I studying Now thrilled thought delving ... …,"Sentiment(polarity=0.75, subjectivity=0.85)",0.75,0.85,en,0,0,BeeHewtweet,False,"novel, research",,Wiltshire,
1240698758553165827,Thu Mar 19 17:56:49 +0000 2020,"<a href=""https://mobile.twitter.com"" rel=""nofollow"">Twitter Web App</a>","🚨@ClayneCrawford MOVIE NEWS‼️

🎬#TheKillingOfTwoLovers worldwide sales rights have been acquired by The Exchange, w… https://t.co/kilPuxHmNV",MOVIE NEWS‼️ worldwide sales rights acquired The Exchange w…,"Sentiment(polarity=0.0, subjectivity=0.0)",0.0,0.0,en,18,9,Julia_Eaton_UK,False,TheKillingOfTwoLovers,ClayneCrawford,,
1240698358395617282,Thu Mar 19 17:55:14 +0000 2020,"<a href=""http://twitter.com/download/iphone"" rel=""nofollow"">Twitter for iPhone</a>",It’s the little things in life that bring me joy like ordering @adamlambert new “SIGNED” CD #Velvet #ThisJustMadeMyDay #Excited #SoHappy,It ’ little things life bring joy like ordering new “ SIGNED ” CD,"Sentiment(polarity=0.24962121212121213, subjectivity=0.38484848484848483)",0.24962121212121213,0.38484848484848483,en,1,0,mmleopard,,"Velvet, ThisJustMadeMyDay, Excited, SoHappy",adamlambert,"Orange County, CA","[[-117.9805519, 33.686723], [-117.9147312, 33.686723], [-117.9147312, 33.7334869], [-117.9805519, 33.7334869]]"
