id,created_at,source,original_text,clean_text,sentiment,polarity,subjectivity,lang,favorite_count,retweet_count,original_author,possibly_sensitive,hashtags,user_mentions,place,place_coord_boundaries
1240981051729571846,Fri Mar 20 12:38:33 +0000 2020,"<a href=""http://twitter.com/download/android"" rel=""nofollow"">Twitter for Android</a>",@ShetlandLibrary @Bookbug_SBT @bbcshetland @PromoteShetland @Shetnews @ShetIslandsCll @shetlandtimes Are 47 year ol… https://t.co/HmcXTzoRkE,Are year ol…,"Sentiment(polarity=0.0, subjectivity=0.0)",0.0,0.0,en,0,0,joolz2610,,,"ShetlandLibrary, Bookbug_SBT, bbcshetland, PromoteShetland, Shetnews, ShetIslandsCll, shetlandtimes",,
1240980203360444416,Fri Mar 20 12:35:11 +0000 2020,"<a href=""http://twitter.com/download/android"" rel=""nofollow"">Twitter for Android</a>",@buskeroo @BBCiPlayer @cbbc @YouTube Ho ho bringe-tastic fun next week #excited,Ho ho bringe-tastic fun next week,"Sentiment(polarity=0.15, subjectivity=0.1)",0.15,0.1,en,0,0,lordparker,,excited,"buskeroo, BBCiPlayer, cbbc, YouTube",London,
1240979892658978818,Fri Mar 20 12:33:57 +0000 2020,"<a href=""http://twitter.com/download/android"" rel=""nofollow"">Twitter for Android</a>","Presenting to you our new look!!
Refreshing our commitment to create better stories, greater impact and an enhanced… https://t.co/FXY9q7veRd",Presenting new look Refreshing commitment create better stories greater impact enhanced…,"Sentiment(polarity=0.40909090909090906, subjectivity=0.6136363636363636)",0.40909090909090906,0.6136363636363636,en,0,0,RpgFoundation,False,,,,
1240978713463922690,Fri Mar 20 12:29:16 +0000 2020,"<a href=""http://instagram.com"" rel=""nofollow"">Instagram</a>",This will be everyone in three weeks!!  There is no one outside! 😂😂😂#covid19 #stircrazy #dogsofinstagram #guarddog… https://t.co/Qd5MDfgrEj,This everyone three weeks There one outside …,"Sentiment(polarity=0.0, subjectivity=0.05)",0.0,0.05,en,0,0,thismom_ROCKS,False,"covid19, stircrazy, dogsofinstagram, guarddog",,,
1240976933497815040,Fri Mar 20 12:22:11 +0000 2020,"<a href=""https://mobile.twitter.com"" rel=""nofollow"">Twitter Web App</a>",RT @JuliasWalks: Tune into @ITV 11.30am this Sunday to watch an episode of Best Walks with A View with Julia Bradbury! Wonder where we will…,Tune 0am Sunday watch episode Best Walks A View Julia Bradbury Wonder will…,"Sentiment(polarity=1.0, subjectivity=0.3)",1.0,0.3,en,0,1,accessTOG,,,"JuliasWalks, ITV",The countryside UK 🌿♿️👍🏽💚,
1240976864786538496,Fri Mar 20 12:21:55 +0000 2020,"<a href=""https://mobile.twitter.com"" rel=""nofollow"">Twitter Web App</a>","RT @QISAtweets: Often, all the attention to make learning fun is focused on elementary and early childhood education ages; however, there i…",Often attention make learning fun focused elementary early childhood education ages however i…,"Sentiment(polarity=0.2333333333333333, subjectivity=0.46666666666666673)",0.2333333333333333,0.46666666666666673,en,0,1,Candace_Davies,,,QISAtweets,Worldwide,
1240975719691419648,Fri Mar 20 12:17:22 +0000 2020,"<a href=""https://mobile.twitter.com"" rel=""nofollow"">Twitter Web App</a>","This pup is the MOST excited that #hoomanishome

#excited #quarantinedogs #dogsoftwitter 
📸 by @AngelJanes7 https://t.co/lPTgMhxa3h",This pup MOST excited,"Sentiment(polarity=0.4375, subjectivity=0.625)",0.4375,0.625,en,1,0,well_woof,False,"hoomanishome, excited, quarantinedogs, dogsoftwitter",AngelJanes7,,
1240974786756521985,Fri Mar 20 12:13:40 +0000 2020,"<a href=""https://mobile.twitter.com"" rel=""nofollow"">Twitter Web App</a>",Tune into @ITV 11.30am this Sunday to watch an episode of Best Walks with A View with Julia Bradbury! Wonder where… https://t.co/qRFl3b41rQ,Tune 0am Sunday watch episode Best Walks A View Julia Bradbury Wonder where…,"Sentiment(polarity=1.0, subjectivity=0.3)",1.0,0.3,en,7,1,JuliasWalks,False,,ITV,Great Britain,
1240972784362233857,Fri Mar 20 12:05:42 +0000 2020,"<a href=""http://instagram.com"" rel=""nofollow"">Instagram</a>",Happy 1st day of Spring!!💚🌞 #firstdayofspring #spring #excited https://t.co/m628b6VVot,Happy st day Spring,"Sentiment(polarity=0.8, subjectivity=1.0)",0.8,1.0,en,0,0,SuccesswScola,False,"firstdayofspring, spring, excited",,"Austintown, Ohio",
1240972657425776641,Fri Mar 20 12:05:12 +0000 2020,"<a href=""http://twitter.com/download/android"" rel=""nofollow"">Twitter for Android</a>","RT @Julia_Eaton_UK: 🚨@ClayneCrawford MOVIE NEWS‼️

🎬#TheKillingOfTwoLovers worldwide sales rights have been acquired by The Exchange, who a…",MOVIE NEWS‼️ worldwide sales rights acquired The Exchange a…,"Sentiment(polarity=0.0, subjectivity=0.0)",0.0,0.0,en,0,9,AmberKeyes10,,TheKillingOfTwoLovers,"Julia_Eaton_UK, ClayneCrawford",Earth  (most of the time) 👽,
1240972612047642626,Fri Mar 20 12:05:01 +0000 2020,"<a href=""https://studio.twitter.com"" rel=""nofollow"">Twitter Media Studio</a>","Who was rooting for Enrico? 😂@RickySmart__

OFFICIAL #EXPOSED BEHIND THE SCENES IS OUT NOW🤩👉https://t.co/ifHvQFHJcA… https://t.co/DsgzOqtFtA",Who rooting Enrico OFFICIAL BEHIND THE SCENES IS OUT NOW🤩,"Sentiment(polarity=-0.4, subjectivity=0.7)",-0.4,0.7,en,1,0,UKfullyfocused,False,EXPOSED,RickySmart__,"London, UK",
1240972454522245120,Fri Mar 20 12:04:23 +0000 2020,"<a href=""http://instagram.com"" rel=""nofollow"">Instagram</a>",#snufflemattime #snufflemat #excited #puppysnuffle #puppypalsmcr #whitefield #manchester #doggiedaycare… https://t.co/I66CW3jye7,…,"Sentiment(polarity=0.0, subjectivity=0.0)",0.0,0.0,en,0,0,ByBettinaSamain,False,"snufflemattime, snufflemat, excited, puppysnuffle, puppypalsmcr, whitefield, manchester, doggiedaycare",,"Prestwich, Manchester","[[-2.319934, 53.343623], [-2.147026, 53.343623], [-2.147026, 53.5702824], [-2.319934, 53.5702824]]"
1240970458826227713,Fri Mar 20 11:56:28 +0000 2020,"<a href=""http://twitter.com/download/iphone"" rel=""nofollow"">Twitter for iPhone</a>","Does anyone sleep? #Anons 

How do you do it? It keeps me in #amazement how some just never sleep. 
#sleep #heal… https://t.co/n09EfbtLiw",Does anyone sleep How It keeps never sleep …,"Sentiment(polarity=0.0, subjectivity=0.0)",0.0,0.0,en,3,0,michelelee_1,False,"Anons, amazement, sleep, heal",,,
1240970316106481664,Fri Mar 20 11:55:54 +0000 2020,"<a href=""https://mobile.twitter.com"" rel=""nofollow"">Twitter Web App</a>","#FirstTweet #Excited 
this is my first tweet. Excited to learn🤩",first tweet Excited learn🤩,"Sentiment(polarity=0.3125, subjectivity=0.5416666666666666)",0.3125,0.5416666666666666,en,1,0,DiyanALI12,,"FirstTweet, Excited",,wardha,
1240969486720778240,Fri Mar 20 11:52:36 +0000 2020,"<a href=""http://twitter.com/download/iphone"" rel=""nofollow"">Twitter for iPhone</a>",I know on #exploration i am gonna start and it #hunting for stuff i got and never put to use #excitement https://t.co/xHBb0n3ZTi,I know gon na start stuff got never put use,"Sentiment(polarity=0.0, subjectivity=0.0)",0.0,0.0,en,0,0,pamsyme1973,False,"exploration, hunting, excitement",,"Florida, USA",
1240969035170406400,Fri Mar 20 11:50:48 +0000 2020,"<a href=""http://twitter.com/download/iphone"" rel=""nofollow"">Twitter for iPhone</a>","@seashellllz We can watch what we doing on the same time:)))
#excitement",We watch time,"Sentiment(polarity=0.0, subjectivity=0.0)",0.0,0.0,en,0,0,bi1maze,,excitement,seashellllz,,
1240965118537719808,Fri Mar 20 11:35:14 +0000 2020,"<a href=""http://twitter.com/download/android"" rel=""nofollow"">Twitter for Android</a>","@tinasloan Oh what a trip...😂😂😂
#exciting #takecareofyourself https://t.co/q3HAea5KQz",Oh trip ...,"Sentiment(polarity=0.0, subjectivity=0.0)",0.0,0.0,en,0,0,boecken13,False,"exciting, takecareofyourself",tinasloan,"Berlin,Germany",
1240965030004379649,Fri Mar 20 11:34:53 +0000 2020,"<a href=""https://twitter.com/streamladder"" rel=""nofollow"">twitchtwitchretweets</a>",RT @edgaming666: I can’t wait any longer I’m going live with #DOOM eternal https://t.co/nImrqZjc1A @TheCommunitychs @FallenLegendsGG @Small…,I ’ wait longer I ’ going live eternal …,"Sentiment(polarity=0.13636363636363635, subjectivity=0.5)",0.13636363636363635,0.5,en,0,5,TwitchReTweets,False,DOOM,"edgaming666, TheCommunitychs, FallenLegendsGG",,
1240964730703024129,Fri Mar 20 11:33:42 +0000 2020,"<a href=""https://anpaus-twitter-chatbot.herokuapp.com/"" rel=""nofollow"">anpaus-twitter-bot</a>",RT @edgaming666: I can’t wait any longer I’m going live with #DOOM eternal https://t.co/nImrqZjc1A @TheCommunitychs @FallenLegendsGG @Small…,I ’ wait longer I ’ going live eternal …,"Sentiment(polarity=0.13636363636363635, subjectivity=0.5)",0.13636363636363635,0.5,en,0,5,pawelterlecki,False,DOOM,"edgaming666, TheCommunitychs, FallenLegendsGG","San Francisco, CA",
1240964621680312321,Fri Mar 20 11:33:16 +0000 2020,"<a href=""https://www.techtronic.us"" rel=""nofollow"">SmallStreamersConnectRT</a>",RT @edgaming666: I can’t wait any longer I’m going live with #DOOM eternal https://t.co/nImrqZjc1A @TheCommunitychs @FallenLegendsGG @Small…,I ’ wait longer I ’ going live eternal …,"Sentiment(polarity=0.13636363636363635, subjectivity=0.5)",0.13636363636363635,0.5,en,0,5,SmallStreamersR,False,DOOM,"edgaming666, TheCommunitychs, FallenLegendsGG",Smallville,
1240963965028651009,Fri Mar 20 11:30:39 +0000 2020,"<a href=""https://www.hootsuite.com"" rel=""nofollow"">Hootsuite Inc.</a>","Often, all the attention to make learning fun is focused on elementary and early childhood education ages; however,… https://t.co/NfCIUxS6Eb",Often attention make learning fun focused elementary early childhood education ages however …,"Sentiment(polarity=0.2333333333333333, subjectivity=0.46666666666666673)",0.2333333333333333,0.46666666666666673,en,2,1,QISAtweets,False,,,"Portland, ME",
1240963628666425346,Fri Mar 20 11:29:19 +0000 2020,"<a href=""http://twitter.com/download/android"" rel=""nofollow"">Twitter for Android</a>",RT @edgaming666: I can’t wait any longer I’m going live with #DOOM eternal https://t.co/nImrqZjc1A @TheCommunitychs @FallenLegendsGG @Small…,I ’ wait longer I ’ going live eternal …,"Sentiment(polarity=0.13636363636363635, subjectivity=0.5)",0.13636363636363635,0.5,en,0,5,Kings_Crt,False,DOOM,"edgaming666, TheCommunitychs, FallenLegendsGG",,
1240963367885512704,Fri Mar 20 11:28:17 +0000 2020,"<a href=""http://twitter.com/download/iphone"" rel=""nofollow"">Twitter for iPhone</a>",I can’t wait any longer I’m going live with #DOOM eternal https://t.co/nImrqZjc1A @TheCommunitychs @FallenLegendsGG… https://t.co/uHsGZrKV9S,I ’ wait longer I ’ going live eternal …,"Sentiment(polarity=0.13636363636363635, subjectivity=0.5)",0.13636363636363635,0.5,en,3,5,edgaming666,False,DOOM,"TheCommunitychs, FallenLegendsGG",,
1240961332813455362,Fri Mar 20 11:20:12 +0000 2020,"<a href=""http://twitter.com/download/android"" rel=""nofollow"">Twitter for Android</a>",Never before has the #market been so #exciting,Never,"Sentiment(polarity=0.0, subjectivity=0.0)",0.0,0.0,en,0,0,FindingFREEDO13,,"market, exciting",,,
1240961176521056256,Fri Mar 20 11:19:35 +0000 2020,"<a href=""http://twitter.com/download/iphone"" rel=""nofollow"">Twitter for iPhone</a>","🍴🍰👩‍🍳 Our #Catering students were treated to an #exciting presentation last November, from the @LutonHooHotel !👩‍🍳🍰🍴 https://t.co/Kd4Hab05AX",‍ Our students treated presentation last November ‍,"Sentiment(polarity=0.0, subjectivity=0.06666666666666667)",0.0,0.06666666666666667,en,0,0,TheLinkAtCBC,False,"Catering, exciting",LutonHooHotel,"Dunstable, England",
1240960429955964929,Fri Mar 20 11:16:37 +0000 2020,"<a href=""http://twitter.com/download/iphone"" rel=""nofollow"">Twitter for iPhone</a>",Making science arty in Y4 today. Still loving learning about the digestive system 😂 #engaged #excited #enthusiastic https://t.co/xGLAUyzM80,Making science arty Y4 today Still loving learning digestive system,"Sentiment(polarity=0.6, subjectivity=0.95)",0.6,0.95,en,6,0,SandiwayPS,False,"engaged, excited, enthusiastic",,"Cheshire, UK",
1240956917704507397,Fri Mar 20 11:02:39 +0000 2020,"<a href=""http://twitter.com/download/android"" rel=""nofollow"">Twitter for Android</a>","Freedom is also here! Here's a sneak peek of what to expect from the Sparkle app. 😊💥
#Sparkle #FridayVibes #excited… https://t.co/2Aeu1LLLvC",Freedom also Here 's sneak peek eect Sparkle app …,"Sentiment(polarity=0.0, subjectivity=0.0)",0.0,0.0,en,0,0,sparkleplaceng,False,"Sparkle, FridayVibes, excited",,Sparkle Place,
1240956715861979136,Fri Mar 20 11:01:51 +0000 2020,"<a href=""https://app.socialpilot.co/"" rel=""nofollow"">SocialPilot.co</a>",UK Property &amp; eCommerce customers can now enjoy the benefits of the iProperty Cloud &amp; the Dynamics 365 All-Channel… https://t.co/NlpYs0wTin,UK Property amp eCommerce customers enjoy benefits iProperty Cloud amp Dynamics All-Channel…,"Sentiment(polarity=0.4, subjectivity=0.5)",0.4,0.5,en,0,0,SolgariConverse,False,,,Worldwide,
1240955668288417792,Fri Mar 20 10:57:41 +0000 2020,"<a href=""http://instagram.com"" rel=""nofollow"">Instagram</a>",Currently working towards the launch of a second project which will link to @CupcakesButterf  Very excited but can'… https://t.co/XD3w5wuKtJ,Currently working towards launch second project link Very excited can'…,"Sentiment(polarity=0.1625, subjectivity=0.4583333333333333)",0.1625,0.4583333333333333,en,1,0,CupcakesTextile,False,,,Caerphilly ,
1240954491631022080,Fri Mar 20 10:53:01 +0000 2020,"<a href=""https://mobile.twitter.com"" rel=""nofollow"">Twitter Web App</a>","@BCampbellCBS UFC 79 with Liddell-W Silva, then St. Pierre-Hughes main event. 

UFC 129 with Aldo-Hominick, then St… https://t.co/mqkUPOQQKb",UFC Liddell-W Silva St. Pierre-Hughes main event UFC Aldo-Hominick St…,"Sentiment(polarity=0.16666666666666666, subjectivity=0.3333333333333333)",0.16666666666666666,0.3333333333333333,en,1,0,TheCrayonmaker,,,BCampbellCBS,"Englewood, NJ",
1240951564073828352,Fri Mar 20 10:41:23 +0000 2020,"<a href=""http://twitter.com/download/iphone"" rel=""nofollow"">Twitter for iPhone</a>","RT @diivesmusic1: I started #WritingSongs when I was 9, it’s all I’ve known! but all I’ve ever wanted was to release a #BodyOfWork that was…",I started I ’ I ’ known I ’ ever wanted release was…,"Sentiment(polarity=0.0, subjectivity=0.0)",0.0,0.0,en,0,2,DeluxxeMGMT,,"WritingSongs, BodyOfWork",diivesmusic1,"London, England",
1240948241488887809,Fri Mar 20 10:28:11 +0000 2020,"<a href=""https://mobile.twitter.com"" rel=""nofollow"">Twitter Web App</a>",@alexheberling #exciting emails - just what I needed - thank!,emails I needed thank,"Sentiment(polarity=0.0, subjectivity=0.0)",0.0,0.0,en,0,0,TCBarrett,,exciting,alexheberling,,
1240941857539940352,Fri Mar 20 10:02:49 +0000 2020,"<a href=""http://instagram.com"" rel=""nofollow"">Instagram</a>","Exciting! I've got my prints for the WPS exhibition, which unfortunately has been cancelled. Still loved opening th… https://t.co/MviVKh80Bz",Exciting I 've got prints WPS exhibition unfortunately cancelled Still loved opening th…,"Sentiment(polarity=0.16666666666666666, subjectivity=0.8666666666666667)",0.16666666666666666,0.8666666666666667,en,0,0,Pinklilith,False,,,england,
1240941332912357377,Fri Mar 20 10:00:43 +0000 2020,"<a href=""https://www.later.com"" rel=""nofollow"">LaterMedia</a>","Great #fummy 's Performance!!⁣⠀⁠
Performance type：DJ
PEEEKTV is SNS media, focused on #yabeeee this performance! ⠀… https://t.co/qJdjzYt69n",Great 's Performance ⁣⠀⁠ Performance type：DJ PEEEKTV SNS media focused performance ⠀…,"Sentiment(polarity=0.8, subjectivity=0.75)",0.8,0.75,en,1,0,PEEEKTV,False,"fummy, yabeeee",,東京 渋谷区,
1240938968297897985,Fri Mar 20 09:51:20 +0000 2020,"<a href=""http://twitter.com/#!/download/ipad"" rel=""nofollow"">Twitter for iPad</a>","RT @birdsinwales: Aren't they good eggs! 
The new and updated Birds of Wales is coming together brilliantly, we'll keep you updated on prog…",Are n't good eggs The new updated Birds Wales coming together brilliantly 'll keep updated prog…,"Sentiment(polarity=0.5787878787878787, subjectivity=0.6848484848484849)",0.5787878787878787,0.6848484848484849,en,0,4,glamorganbirds,,,birdsinwales,Glamorgan,
1240938121170227200,Fri Mar 20 09:47:58 +0000 2020,"<a href=""http://twitter.com/download/android"" rel=""nofollow"">Twitter for Android</a>",@tashabrown_ @manda10110 I'm dure you will give them #excitement. They will enjoy the change i'm sure. Anything but… https://t.co/q6wc7mzZ7g,I 'm dure give They enjoy change 'm sure Anything but…,"Sentiment(polarity=0.45, subjectivity=0.6944444444444444)",0.45,0.6944444444444444,en,0,0,JoanSpkling,,excitement,"tashabrown_, manda10110","Darlington, England",
1240937802981724162,Fri Mar 20 09:46:42 +0000 2020,"<a href=""http://twitter.com/download/android"" rel=""nofollow"">Twitter for Android</a>",Had such A long but A #proactive day 2day!!Spent the afternoon #building my new stand for my fish tank! I'm super… https://t.co/p9kRdeTPjv,Had A long A day day Spent afternoon new stand fish tank I 'm super…,"Sentiment(polarity=-0.0045454545454545565, subjectivity=0.3181818181818182)",-0.0045454545454545565,0.3181818181818182,en,1,0,kelsie_blaze,True,"proactive, building",,New Zealand,
1240936603184398339,Fri Mar 20 09:41:56 +0000 2020,"<a href=""http://twitter.com/download/android"" rel=""nofollow"">Twitter for Android</a>",@emma_shone Sounds good to us 👍  what time ? what game we going for ?  Shall we do a poll ?  #excited 🤣🤣,Sounds good us time game going Shall poll 🤣🤣,"Sentiment(polarity=0.14999999999999997, subjectivity=0.5)",0.14999999999999997,0.5,en,1,0,MCWFC_OSC,,excited,emma_shone,Manchester CFA Stadium,
1240935102575771648,Fri Mar 20 09:35:58 +0000 2020,"<a href=""https://mobile.twitter.com"" rel=""nofollow"">Twitter Web App</a>",Any students who are missing PE and Games lessons next week can sign up to join the cross-country challenges! 🏃… https://t.co/CcdDGndX3p,Any students missing PE Games lessons next week sign join cross-country challenges …,"Sentiment(polarity=-0.1, subjectivity=0.025)",-0.1,0.025,en,5,0,JHGSHW,False,,,"High Wycombe, Buckinghamshire",
1240934743383965696,Fri Mar 20 09:34:32 +0000 2020,"<a href=""https://mobile.twitter.com"" rel=""nofollow"">Twitter Web App</a>",RT @MayhemPrix: Cursives endgame highlights #2 dropping today 😋😋 #excited #cantwait,Cursives endgame highlights dropping today,"Sentiment(polarity=0.0, subjectivity=0.0)",0.0,0.0,en,0,1,LynxEdits_,,"excited, cantwait",MayhemPrix,Worldwide,
1240934393641828352,Fri Mar 20 09:33:09 +0000 2020,"<a href=""http://twitter.com/download/iphone"" rel=""nofollow"">Twitter for iPhone</a>","Season 4 of The Last Kingdom will be released on 26th April, tune in to Netflix to see our very own Helena Albright… https://t.co/Kyi7kw9MQt",Season The Last Kingdom released th April tune Netflix see Helena Albright…,"Sentiment(polarity=0.0, subjectivity=0.06666666666666667)",0.0,0.06666666666666667,en,3,0,MiddletonTalent,False,,,West Sussex,
1240933885455843329,Fri Mar 20 09:31:08 +0000 2020,"<a href=""http://instagram.com"" rel=""nofollow"">Instagram</a>","What does the future look like for our #business ? Do any of us know?

Sometimes a lack of knowledge and understand… https://t.co/PdJBMzEgxB",What future look like Do us know Sometimes lack knowledge understand…,"Sentiment(polarity=0.0, subjectivity=0.125)",0.0,0.125,en,1,0,_attain_sustain,False,business,,"Ipswich, England","[[1.0874009, 52.1043671], [1.104211, 52.1043671], [1.104211, 52.116323], [1.0874009, 52.116323]]"
1240933550297210880,Fri Mar 20 09:29:48 +0000 2020,"<a href=""http://twitter.com/download/iphone"" rel=""nofollow"">Twitter for iPhone</a>",Cursives endgame highlights #2 dropping today 😋😋 #excited #cantwait,Cursives endgame highlights dropping today,"Sentiment(polarity=0.0, subjectivity=0.0)",0.0,0.0,en,37,1,MayhemPrix,,"excited, cantwait",,MES,
1240933075628044289,Fri Mar 20 09:27:55 +0000 2020,"<a href=""http://twitter.com/download/android"" rel=""nofollow"">Twitter for Android</a>","When life gives you lemons, is time to resume your dearest projects and take them to fruition - #excited #newProject https://t.co/jpXvN136xo",When life gives lemons time resume dearest projects take fruition,"Sentiment(polarity=0.0, subjectivity=0.0)",0.0,0.0,en,1,0,andreicontan,False,"excited, newProject",,"Amsterdam, The Netherlands","[[4.7288999, 52.2782266], [5.0792072, 52.2782266], [5.0792072, 52.4312289], [4.7288999, 52.4312289]]"
1240929391636602883,Fri Mar 20 09:13:16 +0000 2020,"<a href=""https://mobile.twitter.com"" rel=""nofollow"">Twitter Web App</a>","RT @birdsinwales: Aren't they good eggs! 
The new and updated Birds of Wales is coming together brilliantly, we'll keep you updated on prog…",Are n't good eggs The new updated Birds Wales coming together brilliantly 'll keep updated prog…,"Sentiment(polarity=0.5787878787878787, subjectivity=0.6848484848484849)",0.5787878787878787,0.6848484848484849,en,0,4,NaturCymru,,,birdsinwales,Wales,
1240926617624555526,Fri Mar 20 09:02:15 +0000 2020,"<a href=""http://twitter.com/download/iphone"" rel=""nofollow"">Twitter for iPhone</a>",RT @jonwoods1: Today were going to launch a new local scout programme for our group to engage with all local YP with fun and education acti…,Today going launch new local scout programme group engage local YP fun education acti…,"Sentiment(polarity=0.10909090909090909, subjectivity=0.16363636363636364)",0.10909090909090909,0.16363636363636364,en,0,1,rosscodw,,,jonwoods1,tunbridge wells,
1240926164283265024,Fri Mar 20 09:00:27 +0000 2020,"<a href=""https://www.hootsuite.com"" rel=""nofollow"">Hootsuite Inc.</a>","You can now listen to my #podcast on your #Amazon speaker! Just say 'Alexa, play the Evolve to Succeed podcast on T… https://t.co/06IymJ3OVU",You listen speaker Just say 'Alexa play Evolve Succeed podcast T…,"Sentiment(polarity=0.0, subjectivity=0.0)",0.0,0.0,en,1,0,warren_munson,False,"podcast, Amazon",,"England, United Kingdom",
1240922666942500864,Fri Mar 20 08:46:33 +0000 2020,"<a href=""https://socialrabbitplugin.com"" rel=""nofollow"">SocialRabbit Plugin</a>","Like if you are Excited! Oh Yeah

#stylishwallart #beautiful #decor #excited #play https://t.co/yAHpd4Y9d0",Like Excited Oh Yeah,"Sentiment(polarity=0.375, subjectivity=0.75)",0.375,0.75,en,1,0,stylishwallart,False,"stylishwallart, beautiful, decor, excited, play",,United States,
1240922148333551616,Fri Mar 20 08:44:30 +0000 2020,"<a href=""https://mobile.twitter.com"" rel=""nofollow"">Twitter Web App</a>","The Quoddy #profilingbed can #expand to 3 different lengths (60"", 66"" and 72"") making this #paediatric #bed suitabl… https://t.co/35cK1BtioH",The Quoddy different lengths 60 '' `` `` making suitabl…,"Sentiment(polarity=0.0, subjectivity=0.6)",0.0,0.6,en,2,0,Centrobed,False,"profilingbed, expand, paediatric, bed",,"Ashford, Kent UK",
1240921878346100736,Fri Mar 20 08:43:25 +0000 2020,"<a href=""https://mobile.twitter.com"" rel=""nofollow"">Twitter Web App</a>",Select a business that you love and know something about. Being passionate about your business will help you overco… https://t.co/4M1TFMwpfk,Select business love know something Being passionate business help overco…,"Sentiment(polarity=0.225, subjectivity=0.7250000000000001)",0.225,0.7250000000000001,en,0,0,rivercitybusine,False,,,"Arlington, TX",
1240920188293390336,Fri Mar 20 08:36:42 +0000 2020,"<a href=""http://twitter.com/download/iphone"" rel=""nofollow"">Twitter for iPhone</a>",Cleanse me GOD. #EXCITED #GOHA https://t.co/8Y1q1FCnTg https://t.co/UjmcMG2Cup,Cleanse GOD,"Sentiment(polarity=0.0, subjectivity=0.0)",0.0,0.0,en,0,0,rickbrewer2010,False,"EXCITED, GOHA",,"Upper Miramichi, New Brunswick",
1240920110937837568,Fri Mar 20 08:36:24 +0000 2020,"<a href=""https://mobile.twitter.com"" rel=""nofollow"">Twitter Web App</a>","I have a @WeAudition profile. @SophHollandCast @fayetimby I would love a time slot, please. 😃… https://t.co/KhGT0MGBnS",I profile I would love time slot please …,"Sentiment(polarity=0.5, subjectivity=0.6)",0.5,0.6,en,0,0,LorieLanie,False,,"WeAudition, SophHollandCast, fayetimby","Kenilworth, Warwickshire",
1240917040761835520,Fri Mar 20 08:24:12 +0000 2020,"<a href=""http://twitter.com/download/android"" rel=""nofollow"">Twitter for Android</a>","RT @Julia_Eaton_UK: 🚨@ClayneCrawford MOVIE NEWS‼️

🎬#TheKillingOfTwoLovers worldwide sales rights have been acquired by The Exchange, who a…",MOVIE NEWS‼️ worldwide sales rights acquired The Exchange a…,"Sentiment(polarity=0.0, subjectivity=0.0)",0.0,0.0,en,0,9,SabrinaHardtke,,TheKillingOfTwoLovers,"Julia_Eaton_UK, ClayneCrawford","Meckenheim, Deutschland",
1240913461086957568,Fri Mar 20 08:09:58 +0000 2020,"<a href=""http://twitter.com/download/android"" rel=""nofollow"">Twitter for Android</a>",#FridayVibes #GoodMorning how are we today? We are looking forward to help build a studio space today for anyone to… https://t.co/tr9cTWtCSf,today We looking forward help build studio space today anyone to…,"Sentiment(polarity=0.0, subjectivity=0.0)",0.0,0.0,en,0,0,Advosound,,"FridayVibes, GoodMorning",,Edinburgh,
